requestNumber,actionId,actionType,beginDate,endDate,requestID,requestId,requestTitle,pi,piInstitution,piUsername,fos,fosTypeId,opportunity,allocationType,abstract,updateDate
NAIRR240040,170062,New,4/22/24,10/22/24,1264632,1264632,The Development Safety of Large Foundation Models,"Yang, Tianbao",Texas A&M University,nairr-user-xxx,Computer Science,502093,NAIRR Pilot Call for Early Allocations,NAIRR Pilot,"This project will investigate an importance issue of continual developing large foundation models. While large foundation models have demonstrated remarkable capabilities across various tasks, they are not without limitations, often necessitating iterative updates to enhance their performance in specific domains or tasks. In order to enhance the system's ability to adapt to the changing and complex world, it is necessary to undergo multiple iterations of model development, which involve collecting new data and training new
models. However, this iterative model development process raises significant safety issues that have been overlooked by existing studies in AI, i.e., the model development for acquiring new safety features may inadvertently lose the previously ensured safety features of the old model. This project will investigate novel approaches to address these issues.",2024-04-26T14:37:37.922Z
NAIRR240042,170047,New,4/22/24,10/22/24,1264617,1264617,Reinforcement Learning from Conversational Signals,"Artzi, Yoav",Cornell University,nairr-user-xxx,Artificial Intelligence and Intelligent Systems,502096,NAIRR Pilot Call for Early Allocations,NAIRR Pilot,"We propose to fine-tune language models from interaction with users without explicit feedback, but instead from signals arising from how humans respond to system outputs in multi-turn conversational interactions. Unlike explicit human feedback, these signals require no annotation effort beyond the interaction itself. We develop an approach to learn from human response to system utterances to improve an underlying large language  model. We use two interaction scenarios for our studies and experiments, and evaluate through deployment with human users.",2024-04-26T14:37:37.922Z
NAIRR240044,169726,New,4/22/24,10/22/24,1264312,1264312,Training and Benchmarking Three Different Foundation Models on Public Histopathology Gigapixel Images for Whole Slide Image Representation,"Tizhoosh, Hamid",Mayo Clinic ,0000-0001-5488-601X,Performance Evaluation and Benchmarking,502085,NAIRR Pilot Call for Early Allocations,NAIRR Pilot,"This proposal addresses the challenge of transforming whole slide images (WSIs) into actionable vectors for different computational pathology (CP) tasks. Despite recent progress in leveraging artificial intelligence (AI) in CP, WSIs pose unique challenges due to their large size and complex features. Our objective is to secure resources to train and benchmark three foundation models tailored for WSI representation. We aim to utilize publicly available datasets to conduct the largest-ever effort in training and benchmarking models at the WSI level. The selected models include LongNet, LambdaNetworks, and RWKV, each offering distinct approaches to long sequence analysis. Leveraging diverse datasets such as TCGA, PANDA, CAMELYON16, BRACS, and BCNB, we will ensure comprehensive coverage for robust training and evaluation. The evaluation will assess the performance of each model across relevant metrics, providing standardized findings for comparison. Given the massive size of WSIs, substantial computational and storage resources are required. Successful implementation of this proposal will advance research in CP, driving innovation and clinical translation. By providing comprehensive evaluations, this initiative empowers the research community to make informed decisions, ultimately improving patient outcomes.",2024-04-26T14:10:29.952Z
NAIRR240045,170052,New,4/22/24,10/22/24,1264622,1264622,"Guardians of Integrity in AI: Establishing Trust, Originality, and Ethical Standards (GATES)","Huang, Furong",University of Maryland,nairr-user-xxx,Artificial Intelligence and Intelligent Systems,502096,NAIRR Pilot Call for Early Allocations,NAIRR Pilot,"The advent of generative AI has ushered in unprecedented capabilities alongside significant ethical and security challenges. Guardians of Integrity in AI: Establishing Trust, Originality, and Ethical Standards (GATES) proposes an innovative research agenda aimed at fortifying the ethical backbone of artificial intelligence. This project targets three pivotal areas: the detection of AI-generated content to combat misinformation, the protection of intellectual property rights to uphold the originality and fairness in AI-generated works, and the development of trustworthy foundation models for enhanced human-AI collaboration. Through GATES, we intend to develop robust methodologies and frameworks that ensure AI systems are safe, secure, and aligned with human values. This initiative not only addresses immediate concerns within the AI community but also lays the groundwork for sustainable, ethical AI development, resonating with the goals of the NAIRR Pilot initiative. By integrating advanced computational techniques with ethical principles, GATES aims to lead the way in establishing a new standard for trustworthy AI, ensuring that these powerful technologies augment human capabilities without compromising ethical standards.",2024-04-26T14:37:37.922Z
NAIRR240046,169739,New,4/22/24,10/22/24,1264321,1264321,Enhancing LM Adaptation toward Safe and Trustworthy AI,"Hajishirzi, Hanna",University of Washington,0000-0002-1055-6657,Computer Science,502093,NAIRR Pilot Call for Early Allocations,NAIRR Pilot,"The capabilities of large language models (LMs) to follow user requests have been progressing rapidly through a wide range of openly available models, datasets, and training methods. In the meantime, we need to make these models safe, secure, and trustworthy. There has been rapid progress in both improving capabilities and safety of language models. Our team at UW are at the forefront of building open-source language models and adapting them to new capabilities and safety measures~\citep{wang2023far}, and making them trustworthy~\cite{asai-etal-2023-retrieval}. Since the release of our state-of-the-art models~\citep{wang2023far},  there have been a number of significant advances in almost all aspects of  language model adaptation, from the release of improved finetuning datasets~\citep{UltraChat, cui2023ultrafeedback}, to  increasingly powerful base models~\citep{touvron2023llama,jiang2023mistral}, to powerful and accessible adaptation methods for combining these components~\citep{rafailov2023direct, dettmers2023qlora}, and retrieval-augmentation models~\cite{asai-etal-2023-retrieval}. Building on our team's prior expertise, we propose to introduce and investigate approaches to make language models safe  and trustworthy.",2024-04-15T20:05:49.132Z
NAIRR240051,170054,New,4/22/24,10/22/24,1264624,1264624,Neuro-inspired Oversight for Safe and Trustworthy Large Language Models,"Kim, Edward",Drexel University,nairr-user-xxx,Artificial Intelligence and Intelligent Systems,502096,NAIRR Pilot Call for Early Allocations,NAIRR Pilot,"We have observed that improving instruction following is fundamentally at odds with the ability of a language model to follow given safety filters or guidelines.  We have previously showed that larger parameter models exhibit superior capability in following instructions that require overriding both internal knowledge and contextual cues, demonstrating a high degree of obedience.  However, our research also highlights a fundamental issue between enhancing a model's ability to override instructions and maintaining adherence to safety protocols and guidelines.  Specifically, the most responsive instruction following LLMs are the ones that can be most easily jailbroken.

In our work, we believe that the architecture of the human brain illustrates a critical point, there is a separation between language understanding and moderation.  This is supported by functional mapping studies that show the language understanding center, e.g. Wernicke's area, and speech moderation and production area, Broca's area and surrounding Frontal Lobe, are in two distant and separate areas of the brain.  We are pursuing research in LLM moderation through the lens of biological intelligence.",2024-04-26T14:37:37.922Z
NAIRR240052,170063,New,4/22/24,10/22/24,1264633,1264633,"Pre-training a generative selective state space model, the Mamba model, on UCSF-specific deidentified clinical notes and time-series structured data","Sushil, Madhumita","University of California, San Francisco",nairr-user-xxx,Artificial Intelligence and Intelligent Systems,502096,NAIRR Pilot Call for Early Allocations,NAIRR Pilot,"While large language models (LLMs) have made unprecedented advances in the general domain, their advances in medicine are limited by access to large datasets and advanced computing infrastructure. Existing publicly available LLMs are not always sufficient for healthcare-specific use, since they either lack domain knowledge, are expensive to use, or cannot be accessed in a HIPAA-compliant setting. To enable more widespread use of AI within medicine, we aim to develop an effective and task-independent foundation model for medicine trained on a large and diverse corpus of deidentified patient data from electronic health records at University of California San Francisco. A recent family of models, selective state space models, have demonstrated promising capabilities in long sequence processing, providing competitive performance to transformers-based models. In this study, we aim to develop a longitudinal selective state space LLM on medical data by encoding sequential knowledge from clinical encounters for generating future clinical states and actions.",2024-04-26T14:37:37.922Z
NAIRR240055,170053,New,4/22/24,10/22/24,1264623,1264623,Securing Healthcare Privacy: Rendering Large-Scale Unlearnable Medical Imaging Data to Prevent Data Leaks,"Huo, Yuankai",Vanderbilt University,nairr-user-xxx,Computer Science,502093,NAIRR Pilot Call for Early Allocations,NAIRR Pilot,"This proposal outlines an innovative secure and trustworthy AI approach to safeguard healthcare data from unauthorized use in AI model training through the development of unlearnable examples (UE). As AI models, including foundation models like ChatGPT, SAM, and Sora, increasingly raise privacy and safety concerns, especially with the unauthorized use of patient data, the National Artificial Intelligence Research Resource (NAIRR) project aims to pioneer privacy-ensured radiological AI. By embedding invisible noise in over 2 million radiological images from MRI and CT scans, this project will generate label-agnostic UE models that protect medical imaging data against misuse in future AI training, without compromising their clinical utility. The project will leverage cutting-edge UE algorithms, high-performance computing, and Vision Transformer models to achieve its objectives. It addresses the urgent need for robust privacy measures in healthcare data, responding to the risks posed by the repurposing of medical imaging for AI training without explicit consent. The proposal also outlines a comprehensive strategy to overcome the challenges of developing UE models for healthcare, including the need for large-scale medical image datasets and substantial computational resources. Aim 1 focuses on rendering large-scale medical imaging data unlearnable, while Aim 2 assesses the effectiveness of UE models against various target models and advanced defenses. The project plans a six-month timeline to achieve its goals, aiming for outcomes that will be shared in leading academic venues. The success of this NAIRR project is expected to significantly advance the field of AI healthcare data security by utilizing Vanderbilt's clinical imaging data in conjunction with DOE's Leadership Computing Facility. This will lay the groundwork for future collaborations and open new avenues for healthcare and high-performance computing (HPC) AI research, ensuring privacy and intellectual property protections for sensitive healthcare data.",2024-04-26T14:37:37.922Z
NAIRR240057,169780,New,4/22/24,10/22/24,1264357,1264357,Unified Representation Learning,"Shrivastava, Abhinav","University of Maryland, College Park",0000-0001-8928-8554,Artificial Intelligence and Intelligent Systems,502096,NAIRR Pilot Call for Early Allocations,NAIRR Pilot,"Deep learning has dominated the fields of generative modeling and discriminative visual recognition for the past decade. For generative tasks, a deep learning model seeks to synthesize or edit parts of images, while for discriminative tasks, it learns to label images or parts of images.  We argue that both of these can be considered complementary and intuitively should help each other because both need a semantic understanding of the underlying structure. We will develop unsupervised unified representations, for generative and discriminative tasks, to be used as general-purpose representations for various downstream tasks like image recognition, reconstruction, and synthesis. Such unified models can be efficiently finetuned for multiple downstream tasks, as opposed to having to pre-train large, expensive models separately for different tasks.",2024-04-15T20:35:30.212Z
NAIRR240088,169923,New,4/22/24,10/22/24,1264511,1264511,Use of AI and sub-meter resolution satellite imagery to map permafrost thaw disturbances and human-built infrastructure at pan-Arctic scale,"Witharana, Chandi","University of Connecticut (Storrs, CT)",nairr-user-agqmx,Geology and Solid Earth Sciences,502117,NAIRR Pilot Call for Early Allocations,NAIRR Pilot,"The Arctic is experiencing more rapid warming than many other regions leading to degradation of permafrost, - the permanently frozen earth materials that remain at 0°C or below for two or more consecutive years-, at an alarming rate. Widespread permafrost thaw induced disturbances negatively impact an array of natural processes, altering hydrology, vegetation dynamics and biogeochemical fluxes, and posing serious threat to human-built environment by damaging buildings and critical infrastructure sitting on permafrost-affected ground.  Permafrost thaw disturbances and microtopographic transitions are no longer localized phenomena but extend across the Arctic. Conventional field surveys and local-scale monitoring mechanisms are unable to offer synoptic assessments of permafrost degradations and ramifications on natural and human-built environments.  Consequently, there is a dire need for new monitoring tools to precisely map permafrost landforms and thaw disturbances and monitor their changes over time and assess the permafrost thaw risk on human-built infrastructure. 
Permafrost dominated landscape in the Arctic harbor a variety of distinctive landforms shaped by the freezing and thawing of the ground.  Ice-wedge polygons (IWPs), the most conspicuous and critical microtopographic formation found in the cold continuous permafrost regions, are underlain by several meter-wide and deep ice-wedges that form a network across the tundra. The microtopography associated with IWPs dictates the Arctic ecosystem from local to regional scales due to the impacts on the flow and storage of water and consequently alter vegetation and carbon dynamics. Field and remote sensing-based studies reported ice-wedge degradation transformation of low-centered polygons into high-centered polygons due to permafrost thaw at several locations across the Arctic tundra. Spatially patchy and temporally sparse knowledge on ice-wedge polygon system's dynamics inevitably lead to uncertainties in regional and pan-Arctic estimates of carbon, water, and energy fluxes. Closing such critical information gaps and improving multi-scale models require objective and detailed geospatial data sets consolidating the ice wedge polygon extent and their prevailing successional stages.
The entire Arctic has been imaged by sub-meter resolution Maxar satellite sensors multiple times during the last two decades. Data repositories holding millions of Maxar images are now at petabyte scale. However, comprehensive Pan-Arctic science products derived from this imagery are scarce. This is largely due to data size (big data) and semantic complexity of satellite images. With the funding from NSF Polar Programs (award #s: 1927723, 1827872, 1927720), we pursue the first-of-its-kind permafrost science use case that capitalizes on a large volume of commercial satellite imagery to create the first Pan-Artic scale ice-wedge polygon map covering > 5 million km2 in the Arctic. We harnessed thousands of Maxar imagery, deep learning CNNs, and high-performance computing resources to develop a scalable and reproducible image-to-assessment pipeline. The operational implementation of our mapping pipeline on high-performance computing systems has detected more than one billion individual IWPs. The deep learning model predictions comprise spatial outlining of IWPs coupled with their classification and geometrical attributes at individual IWP-level. The resulting Pan-Arctic ice-wedge polygon map holds significant potential to serve a diverse user community, facilitating a deeper understanding of the intricate and interconnected processes governing the evolution of the ice-wedge polygon tundra landscape. 
The technical goal of this proposal is to improve the performance of our GeoAI pipeline by integrating vision transformers and extending its capabilities to map other important features. Self-attention-based neural net architectures, in particular Transformers have shown extraordinary success in multiple domains, especially in natural language processing (e.g., Chat GPT). Since foundation models are trained on internet-scale training data sets, they can be generalized with zero-shot and few-shot learning to a new task. The introduction of Segment Anything Model (SAM) is an attempt to come out with a foundation model for image segmentation tasks. SAM enables image segmentation without having to train the model on a large set of training samples (zero-shot learning). As with ChatGPT, SAM also uses a transformer-based approach. DL is rapidly moving away from the CNN-based computer vision models to vision transformers (ViTs). Currently, ViT-based models exhibit great promise on benchmark segmentation datasets. However, one major challenge is in adopting ViTs from everyday images to be able to segment geo-objects in high resolution satellite images. Continued access to HPC resources is critical for us to improve the existing DL pipelines via the introduction of new technologies, training and tuning of models, and to create new geospatial map products and reach our new aims successfully. The central objective of this proposal is to request HPC resources that are necessary to develop, train and validate transformer-based AI models.",2024-04-26T14:37:37.922Z
NAIRR240091,169428,New,4/22/24,10/22/24,1263968,1263968,Privacy-Preserving Synthetic Data Generation for AI Research,"De Cock, Martine",University of Washington Tacoma,0000-0001-7917-0771,Artificial Intelligence and Intelligent Systems,502096,NAIRR Pilot Call for Early Allocations,NAIRR Pilot,"Data is the lifeblood of AI. Much of the most valuable data in the nation however is siloed in research centers, hospitals, banks, etc. The long and onerous processes that researchers have to go through to access each silo is causing a substantial underutilization of AI in many of the most important domains, including healthcare, genomics, justice, education, and finance. Synthetic data generation (SDG) offers an appealing solution to make data more broadly available for AI research while mitigating privacy concerns. Current SDG algorithms however lack provisions for protection of input privacy. Our goal is to leverage the NAIRR infrastructure to make it possible for data holders to contribute their data to an SDG process without disclosing that data in an unencrypted manner. The enhanced privacy brought by the ability to train synthetic data generators over encrypted data comes at a significant computational cost, which is a justifiable price to pay in very sensitive domains like healthcare and genomics.",2024-04-26T14:56:11.589Z
NAIRR240113,169997,New,4/22/24,10/22/24,1264568,1264568,"Scalable Editing of Vision-Language Models, With Applications to Cyber-Physical Systems","Hegde, Chinmay",New York University,0000-0003-4574-8066,Artificial Intelligence and Intelligent Systems,502096,NAIRR Pilot Call for Early Allocations,NAIRR Pilot,"This NAIRR Pilot project seeks to enable significant advances in scalable model editing approaches for making multimodal AI models safe, robust, and aligned with desirable societal values. Model editing refers to the process of systematically adjusting the weights of an existing (trained) AI model so that the new model obeys certain desiderata. Most model editing approaches suffer from issues of scale (they work only for small-scale models) and extent (they are only able to change model properties to a limited degree). Our project seeks to test novel strategies that can significantly surpass such limitations.",2024-04-16T14:26:27.624Z
NAIRR240115,170002,New,4/22/24,10/22/24,1264573,1264573,Agricultural pest identification with robustness guarantees,"Ganapathysubramanian, Baskar",Iowa State University,0000-0002-8931-4852,"Agriculture, Forestry, and Fisheries",502065,NAIRR Pilot Call for Early Allocations,NAIRR Pilot,"This proposal requests computational resources on TACC Frontera to advance a transformative project in agriculture: developing a robust foundational vision model for pest identification (insects, weeds, and diseases). It builds on preliminary work with InsectNet, a model trained on a large dataset of insect images, to expand its capabilities significantly. The team aims to utilize an expanded dataset of approximately 100 million images and incorporate new architectures, including transformers, to enhance model accuracy, scalability, and robustness. A key innovation is the introduction of certified robustness to ensure model reliability against adversarial attacks, making it a crucial tool for improving agricultural outcomes globally. This project is supported by the USDA-NIFA and NSF-funded AI Institute for Resilient Agriculture and an NSF CPS Frontiers grant, underscoring its importance and potential impact on sustainable food production.",2024-04-15T20:39:07.485Z
NAIRR240122,170005,New,4/22/24,10/22/24,1264576,1264576,Community Runnable Earth Digital Intelligence Twin Training and Reforecats,"Gagne, David",National Center for Atmospheric Research,0000-0002-0469-2740,Artificial Intelligence and Intelligent Systems,502096,NAIRR Pilot Call for Early Allocations,NAIRR Pilot,"The goal of the Community Runnable Earth Digital Intelligence Twin (CREDIT) project is to develop, train, and evaluate global and regional artificial intelligence numerical weather prediction (AI NWP) models in an open, scaleable, science-focused framework. We will investigate how choices in the data processing, architecture, loss functions, and evaluation lead to more accurate, stable, physically consistent, and valuable AI NWP models and produce large sets of reforecasts for further analysis and evaluation by the broader community.",2024-04-16T13:56:40.979Z
NAIRR240129,169898,New,4/22/24,10/22/24,1264497,1264497,Exploring Iterative Reasoning in LLMs and the Transferability to Multimodal Models,"Winder, John",Johns Hopkins University Applied Physics Laboratory,nairr-user-ikier,Artificial Intelligence and Intelligent Systems,502096,NAIRR Pilot Call for Early Allocations,NAIRR Pilot,"This project aims to explore the reasoning process of Large Language Models (LLMs) and investigate the generalizability of these capabilities from text to multimodal contexts using joint embedding models. We hypothesize that transformers, the underlying architecture of LLMs, perform semantic reasoning through an iterative numerical optimization process. Through analyzing token transformations and employing techniques like principal component analysis (PCA), we seek to understand and interpret LLM's reasoning processes. Additionally, we will investigate the transferability of this reasoning process to other modalities by leveraging the ImageBind model. This study not only seeks to better understand the reasoning mechanisms of LLMs but also to apply these findings to modalities beyond text.",2024-04-16T13:43:48.875Z
